{
  "artifact_type": "mcq",
  "version": "1.0",
  "questions": [
    {
      "id": "mcq_001",
      "stem": "Which of the following describes Newton's second law, also known as F=ma?",
      "options": [
        "A) A constant force acting on an object will not change its motion unless a torque is applied.",
        "B) The acceleration of an object is directly proportional to the net force acting on it and inversely proportional to its mass.",
        "C) The weight of an object is always equal to its momentum.",
        "D) The speed of an object is directly proportional to the net force acting on it."
      ],
      "answer_index": 1,
      "rationale": "Newton's second law describes the relationship between force (F), mass (m), and acceleration (a).",
      "bloom_level": "understand",
      "source_refs": [
        "N1"
      ]
    }
  ],
  "provenance": {
    "N1": {
      "note_id": "note_001",
      "similarity": 0.31,
      "preview": "# Study Session Context ## Current Study Session Information ### Session Details - **Date**: Decembe..."
    },
    "N2": {
      "note_id": "note_002",
      "similarity": 0.31,
      "preview": "# Study Session Context ## Current Study Session Information ### Session Details - **Date**: Decembe..."
    },
    "N3": {
      "note_id": "note_003",
      "similarity": 0.278,
      "preview": "ormality**: Using appropriate level of formality for academic writing - **Objectivity**: Presenting ..."
    },
    "N4": {
      "note_id": "note_004",
      "similarity": 0.278,
      "preview": "ormality**: Using appropriate level of formality for academic writing - **Objectivity**: Presenting ..."
    },
    "N5": {
      "note_id": "note_005",
      "similarity": 0.274,
      "preview": "ice OOP design patterns and inheritance 4. Review physics formulas and problem-solving strategies 5...."
    }
  },
  "metrics": {
    "tokens_in": 136,
    "tokens_out": 211,
    "latency_ms": 1496.42,
    "retrieval_scores": [
      0.31034498605561445,
      0.31034498605561445,
      0.2780847222570504,
      0.2780847222570504,
      0.2744206196373778
    ]
  }
}