{
  "artifact_type": "mcq",
  "version": "1.0",
  "questions": [
    {
      "id": "mcq_001",
      "stem": "What is the relationship between force, mass, and acceleration according to Newton's second law of motion?",
      "options": [
        "F = m / a",
        "F = m * a",
        "F = a / m",
        "F = m + a"
      ],
      "answer_index": 1,
      "rationale": "Newton's second law states that force (F) is equal to mass (m) times acceleration (a), which is often expressed as F = ma.",
      "bloom_level": "apply",
      "source_refs": [
        "N2"
      ]
    }
  ],
  "provenance": {
    "N1": {
      "note_id": "note_001",
      "similarity": 0.325,
      "preview": "# Study Session Context ## Current Study Session Information ### Session Details - **Date**: Decembe..."
    },
    "N2": {
      "note_id": "note_002",
      "similarity": 0.325,
      "preview": "# Study Session Context ## Current Study Session Information ### Session Details - **Date**: Decembe..."
    },
    "N3": {
      "note_id": "note_003",
      "similarity": 0.298,
      "preview": "ice OOP design patterns and inheritance 4. Review physics formulas and problem-solving strategies 5...."
    },
    "N4": {
      "note_id": "note_004",
      "similarity": 0.298,
      "preview": "ice OOP design patterns and inheritance 4. Review physics formulas and problem-solving strategies 5...."
    },
    "N5": {
      "note_id": "note_005",
      "similarity": 0.295,
      "preview": "ems - Work on eigenvalue calculations - Complete Python class implementation - Review physics formul..."
    }
  },
  "metrics": {
    "tokens_in": 108,
    "tokens_out": 145,
    "latency_ms": 6758.38,
    "retrieval_scores": [
      0.32485831588703384,
      0.32485831588703384,
      0.2976019901709757,
      0.2976019901709757,
      0.2953548701757178
    ]
  }
}